{
  "$schema": "https://json-schema.org/draft/2020-12/schema",
  "$id": "crinkl://protocol/schemas/w3c_bitstring_status_list_credential_v1",
  "title": "CrinklBitstringStatusListCredentialV1",
  "type": "object",
  "additionalProperties": false,
  "required": ["@context", "id", "type", "issuer", "validFrom", "credentialSubject", "proof"],
  "properties": {
    "@context": {
      "type": "array",
      "prefixItems": [
        { "const": "https://www.w3.org/ns/credentials/v2" },
        { "const": "https://www.w3.org/ns/credentials/status/v1" },
        { "const": "https://crinkl.xyz/ns/spend/v1" }
      ],
      "items": false,
      "minItems": 3,
      "maxItems": 3
    },
    "id": { "$ref": "#/$defs/statusListUrl" },
    "type": { "const": ["VerifiableCredential", "BitstringStatusListCredential"] },
    "issuer": { "type": "string", "pattern": "^did:web:[a-z0-9.-]+(?::[a-z0-9._~-]+)*$" },
    "validFrom": { "$ref": "#/$defs/timestamp" },
    "credentialSubject": { "$ref": "#/$defs/subject" },
    "proof": { "$ref": "#/$defs/proof" }
  },
  "$defs": {
    "timestamp": { "type": "string", "format": "date-time", "pattern": "^\\d{4}-\\d{2}-\\d{2}T\\d{2}:\\d{2}:\\d{2}\\.\\d{3}Z$" },
    "hash": { "type": "string", "pattern": "^sha256:[0-9a-f]{64}$" },
    "statusListUrl": { "type": "string", "format": "uri", "pattern": "^https://[A-Za-z0-9.-]+(?::[0-9]+)?(?:/[A-Za-z0-9._~%-]+)+$" },
    "subject": {
      "type": "object",
      "additionalProperties": false,
      "required": ["id", "type", "statusPurpose", "encodedList"],
      "properties": {
        "id": { "type": "string", "format": "uri", "pattern": "^https://[^#]+#list$" },
        "type": { "const": "BitstringStatusList" },
        "statusPurpose": { "enum": ["revocation", "refresh"] },
        "encodedList": { "type": "string", "pattern": "^u[A-Za-z0-9_-]+$" }
      }
    },
    "proof": {
      "type": "object",
      "additionalProperties": false,
      "required": ["@context", "type", "cryptosuite", "created", "verificationMethod", "proofPurpose", "issuerHistoryRef", "proofValue"],
      "properties": {
        "@context": {
          "type": "array",
          "prefixItems": [
            { "const": "https://www.w3.org/ns/credentials/v2" },
            { "const": "https://www.w3.org/ns/credentials/status/v1" },
            { "const": "https://crinkl.xyz/ns/spend/v1" }
          ],
          "items": false,
          "minItems": 3,
          "maxItems": 3
        },
        "type": { "const": "DataIntegrityProof" },
        "cryptosuite": { "const": "eddsa-jcs-2022" },
        "created": { "$ref": "#/$defs/timestamp" },
        "verificationMethod": { "type": "string", "pattern": "^did:web:[a-z0-9.-]+(?::[a-z0-9._~-]+)*#[A-Za-z0-9._-]+$" },
        "proofPurpose": { "const": "assertionMethod" },
        "issuerHistoryRef": { "$ref": "#/$defs/hash" },
        "proofValue": { "type": "string", "maxLength": 89, "pattern": "^z[1-9A-HJ-NP-Za-km-z]+$" }
      }
    }
  }
}
